{
  "schema": "skill/v1",
  "id": "NUM-B-13",
  "review": "needs-editor",
  "domain": "numbers",
  "band": "B",
  "title": [
    {
      "t": "he",
      "v": "ציר המספרים"
    }
  ],
  "worldObject": "dock",
  "childLine": [
    {
      "t": "he",
      "v": "קוֹפְצִים עַל צִיר הַמִּסְפָּרִים"
    }
  ],
  "prerequisites": [
    {
      "skill": "NUM-B-11",
      "weight": 1
    }
  ],
  "representations": [
    "pictorial"
  ],
  "misconceptions": [
    "M-NL-SPACE",
    "M-NL-DIR"
  ],
  "retention": {
    "targetRetention": 0.9,
    "initialStabilityDays": 1
  }
}
