{
  "schema": "skill/v1",
  "id": "NUM-A-08",
  "review": "needs-editor",
  "domain": "numbers",
  "band": "A",
  "title": [
    {
      "t": "he",
      "v": "בוחרים את הספרה 1–5 כשאומרים אותה"
    }
  ],
  "worldObject": "stall",
  "childLine": [
    {
      "t": "he",
      "v": "מוֹצְאִים אֶת הַמִּסְפָּר שֶׁאוֹמְרִים"
    }
  ],
  "prerequisites": [
    {
      "skill": "NUM-A-01",
      "weight": 1
    }
  ],
  "representations": [
    "symbolic"
  ],
  "misconceptions": [],
  "retention": {
    "targetRetention": 0.9,
    "initialStabilityDays": 1
  }
}
